{
  "schemaType": "nansen.options",
  "schemaVersion": "0.1.0",
  "method": {
    "id": "ophys.normcorre",
    "version": "1.0.0"
  },
  "name": "nonrigid",
  "description": "dev's NoRMCorre preset Nonrigid (4x4), its default: piecewise rigid in 4 x 4 patches",
  "values": {
    "maxShift": 40,
    "maxDeviation": 15,
    "overlap": 32,
    "upsampling": 50,
    "iterations": 1,
    "updateTemplate": true,
    "initialBatchSize": 100,
    "binWidth": 50,
    "patches": 4,
    "gridSize": 0
  }
}
